{"$schema":"https://json-schema.org/draft/2020-12/schema","title":"XUNIAverse Universe Catalog","type":"object","required":["id","name","version","systems"],"properties":{"id":{"type":"string","minLength":1},"name":{"type":"string","minLength":1},"version":{"type":"string"},"defaultSystem":{"type":"string"},"systems":{"type":"array","minItems":1,"items":{"type":"object","required":["id","name","star","worlds"],"properties":{"id":{"type":"string"},"name":{"type":"string"},"position":{"type":"array","items":{"type":"number"},"minItems":3,"maxItems":3},"star":{"type":"object","required":["name","radius","color"]},"worlds":{"type":"array","items":{"type":"object","required":["id","name","radius","orbitRadius","color"]}}}}}}}
